{
  "schema_version": "2.0",
  "id": "prompt-architect-catalog",
  "version": "2.0.0",
  "language": "en",
  "packs": [
    {
      "id": "scene-location-studio",
      "library": "location",
      "domain": "scene",
      "path": "packs/scene/scene-location-studio.json",
      "version": "2.0.0",
      "language": "en",
      "status": "active",
      "safety": "general",
      "tags": [
        "base",
        "indoor",
        "studio"
      ],
      "dependencies": [],
      "priority": 10
    },
    {
      "id": "style-photo-genre-base",
      "library": "photo-genre",
      "domain": "style",
      "path": "packs/style/style-photo-genre-base.json",
      "version": "2.0.0",
      "language": "en",
      "status": "active",
      "safety": "general",
      "tags": [
        "base",
        "photographic"
      ],
      "dependencies": [],
      "priority": 10
    },
    {
      "id": "wardrobe-theme-contemporary",
      "library": "wardrobe-theme",
      "domain": "wardrobe",
      "path": "packs/wardrobe/wardrobe-theme-contemporary.json",
      "version": "2.0.0",
      "language": "en",
      "status": "active",
      "safety": "general",
      "tags": [
        "base",
        "contemporary"
      ],
      "dependencies": [],
      "priority": 10
    },
    {
      "id": "scene-location-urban",
      "library": "location",
      "domain": "scene",
      "path": "packs/scene/scene-location-urban.json",
      "version": "2.0.0",
      "language": "en",
      "status": "active",
      "safety": "general",
      "tags": [
        "outdoor",
        "urban"
      ],
      "dependencies": [],
      "priority": 20
    },
    {
      "id": "style-photo-genre-art",
      "library": "photo-genre",
      "domain": "style",
      "path": "packs/style/style-photo-genre-art.json",
      "version": "2.0.0",
      "language": "en",
      "status": "active",
      "safety": "general",
      "tags": [
        "art-direction"
      ],
      "dependencies": [],
      "priority": 20
    },
    {
      "id": "wardrobe-theme-editorial",
      "library": "wardrobe-theme",
      "domain": "wardrobe",
      "path": "packs/wardrobe/wardrobe-theme-editorial.json",
      "version": "2.0.0",
      "language": "en",
      "status": "active",
      "safety": "general",
      "tags": [
        "editorial",
        "fashion"
      ],
      "dependencies": [],
      "priority": 20
    },
    {
      "id": "scene-location-nature",
      "library": "location",
      "domain": "scene",
      "path": "packs/scene/scene-location-nature.json",
      "version": "2.0.0",
      "language": "en",
      "status": "active",
      "safety": "general",
      "tags": [
        "nature",
        "outdoor"
      ],
      "dependencies": [],
      "priority": 30
    },
    {
      "id": "wardrobe-one-piece-mature-fashion",
      "library": "one-piece",
      "domain": "wardrobe",
      "path": "packs/wardrobe/wardrobe-one-piece-mature-fashion.json",
      "version": "2.0.0",
      "language": "en",
      "status": "active",
      "safety": "fashion-mature",
      "tags": [
        "fashion",
        "mature"
      ],
      "dependencies": [],
      "priority": 30
    },
    {
      "id": "wardrobe-theme-historical",
      "library": "wardrobe-theme",
      "domain": "wardrobe",
      "path": "packs/wardrobe/wardrobe-theme-historical.json",
      "version": "2.0.0",
      "language": "en",
      "status": "active",
      "safety": "general",
      "tags": [
        "historical"
      ],
      "dependencies": [],
      "priority": 30
    },
    {
      "id": "scene-location-interior",
      "library": "location",
      "domain": "scene",
      "path": "packs/scene/scene-location-interior.json",
      "version": "2.0.0",
      "language": "en",
      "status": "active",
      "safety": "general",
      "tags": [
        "indoor",
        "interior"
      ],
      "dependencies": [],
      "priority": 40
    },
    {
      "id": "wardrobe-theme-fantasy",
      "library": "wardrobe-theme",
      "domain": "wardrobe",
      "path": "packs/wardrobe/wardrobe-theme-fantasy.json",
      "version": "2.0.0",
      "language": "en",
      "status": "active",
      "safety": "general",
      "tags": [
        "fantasy"
      ],
      "dependencies": [],
      "priority": 40
    },
    {
      "id": "scene-location-historical",
      "library": "location",
      "domain": "scene",
      "path": "packs/scene/scene-location-historical.json",
      "version": "2.0.0",
      "language": "en",
      "status": "active",
      "safety": "general",
      "tags": [
        "historical"
      ],
      "dependencies": [],
      "priority": 50
    },
    {
      "id": "wardrobe-theme-dark",
      "library": "wardrobe-theme",
      "domain": "wardrobe",
      "path": "packs/wardrobe/wardrobe-theme-dark.json",
      "version": "2.0.0",
      "language": "en",
      "status": "active",
      "safety": "dark-atmospheric",
      "tags": [
        "dark",
        "gothic"
      ],
      "dependencies": [],
      "priority": 50
    },
    {
      "id": "scene-location-fantasy",
      "library": "location",
      "domain": "scene",
      "path": "packs/scene/scene-location-fantasy.json",
      "version": "2.0.0",
      "language": "en",
      "status": "active",
      "safety": "general",
      "tags": [
        "fantasy"
      ],
      "dependencies": [],
      "priority": 60
    },
    {
      "id": "scene-location-dark",
      "library": "location",
      "domain": "scene",
      "path": "packs/scene/scene-location-dark.json",
      "version": "2.0.0",
      "language": "en",
      "status": "active",
      "safety": "dark-atmospheric",
      "tags": [
        "dark",
        "gothic"
      ],
      "dependencies": [],
      "priority": 70
    },
    {
      "id": "body-build-base",
      "library": "body-build",
      "domain": "body",
      "path": "packs/body/body-build-base.json",
      "version": "2.0.0",
      "language": "en",
      "status": "active",
      "safety": "general",
      "tags": [
        "adults-only",
        "base"
      ],
      "dependencies": [],
      "priority": 100
    },
    {
      "id": "cinematography-aperture-base",
      "library": "aperture",
      "domain": "cinematography",
      "path": "packs/cinematography/cinematography-aperture-base.json",
      "version": "2.0.0",
      "language": "en",
      "status": "active",
      "safety": "general",
      "tags": [
        "base"
      ],
      "dependencies": [],
      "priority": 100
    },
    {
      "id": "cinematography-camera-angle-base",
      "library": "camera-angle",
      "domain": "cinematography",
      "path": "packs/cinematography/cinematography-camera-angle-base.json",
      "version": "2.0.0",
      "language": "en",
      "status": "active",
      "safety": "general",
      "tags": [
        "base"
      ],
      "dependencies": [],
      "priority": 100
    },
    {
      "id": "cinematography-camera-motion-base",
      "library": "camera-motion",
      "domain": "cinematography",
      "path": "packs/cinematography/cinematography-camera-motion-base.json",
      "version": "2.0.0",
      "language": "en",
      "status": "active",
      "safety": "general",
      "tags": [
        "base"
      ],
      "dependencies": [],
      "priority": 100
    },
    {
      "id": "cinematography-composition-base",
      "library": "composition",
      "domain": "cinematography",
      "path": "packs/cinematography/cinematography-composition-base.json",
      "version": "2.0.0",
      "language": "en",
      "status": "active",
      "safety": "general",
      "tags": [
        "base"
      ],
      "dependencies": [],
      "priority": 100
    },
    {
      "id": "cinematography-exposure-film-look-base",
      "library": "exposure-film-look",
      "domain": "cinematography",
      "path": "packs/cinematography/cinematography-exposure-film-look-base.json",
      "version": "2.0.0",
      "language": "en",
      "status": "active",
      "safety": "general",
      "tags": [
        "base"
      ],
      "dependencies": [],
      "priority": 100
    },
    {
      "id": "cinematography-focus-base",
      "library": "focus",
      "domain": "cinematography",
      "path": "packs/cinematography/cinematography-focus-base.json",
      "version": "2.0.0",
      "language": "en",
      "status": "active",
      "safety": "general",
      "tags": [
        "base"
      ],
      "dependencies": [],
      "priority": 100
    },
    {
      "id": "cinematography-lens-focal-base",
      "library": "lens-focal",
      "domain": "cinematography",
      "path": "packs/cinematography/cinematography-lens-focal-base.json",
      "version": "2.0.0",
      "language": "en",
      "status": "active",
      "safety": "general",
      "tags": [
        "base"
      ],
      "dependencies": [],
      "priority": 100
    },
    {
      "id": "cinematography-light-direction-base",
      "library": "light-direction",
      "domain": "cinematography",
      "path": "packs/cinematography/cinematography-light-direction-base.json",
      "version": "2.0.0",
      "language": "en",
      "status": "active",
      "safety": "general",
      "tags": [
        "base"
      ],
      "dependencies": [],
      "priority": 100
    },
    {
      "id": "cinematography-light-quality-base",
      "library": "light-quality",
      "domain": "cinematography",
      "path": "packs/cinematography/cinematography-light-quality-base.json",
      "version": "2.0.0",
      "language": "en",
      "status": "active",
      "safety": "general",
      "tags": [
        "base"
      ],
      "dependencies": [],
      "priority": 100
    },
    {
      "id": "cinematography-light-source-base",
      "library": "light-source",
      "domain": "cinematography",
      "path": "packs/cinematography/cinematography-light-source-base.json",
      "version": "2.0.0",
      "language": "en",
      "status": "active",
      "safety": "general",